{
  "schema_version": "1.0",
  "artifact_role": "WEB_OF_LIES_LINEAGE_PACKET",
  "packet_id": "WOL-PKT-F15E-CSAR-URANIUM-20260920",
  "claim_family_id": "CH-F15E-CSAR-URANIUM",
  "as_of": "2026-09-20T12:28:00-04:00",
  "basis_paths": [
    "data/claims-forensics/lie-ledger-semantic-overlay-20260919.json",
    "data/evidence-integration/f15e-isfahan-source-provenance-20260920.json",
    "data/forensic-v1.3.2/iranian-claim-evolution.json",
    "data/forensic-v1.3.2/pilot-rescue-timeline.json",
    "data/lie-ledger-v2-rook-authority.json",
    "data/source-registry.json"
  ],
  "notes": "Initial model lineage. It records publication/origin/carrier behavior and canonical claim references without changing Claims Forensics truth or knowledge adjudications. False media artifacts attached to this chain remain explicitly unattributed where Claims Forensics did not establish official origin.",
  "source_profiles": [
    {
      "source_id": "WOL-SRC-BAGHAEI",
      "display_name": "Esmaeil Baghaei",
      "source_entity_type": "PERSON",
      "country_region": "Iran",
      "primary_platform": null,
      "canonical_outlet_profile_id": null,
      "canonical_actor_id": null,
      "canonical_source_ids": [
        "SRC-0C0023C8A3BF"
      ],
      "behavior_classes": [
        "OFFICIAL_SOURCE"
      ],
      "authenticity_class": "UNKNOWN",
      "revenue_model": [
        "UNKNOWN_REVENUE_MODEL"
      ],
      "classification_basis_event_ids": [
        "WOL-EVT-F15E-012"
      ],
      "revenue_basis_event_ids": []
    },
    {
      "source_id": "WOL-SRC-IRAN-INTERNATIONAL",
      "display_name": "Iran International",
      "source_entity_type": "OUTLET",
      "country_region": null,
      "primary_platform": "Web",
      "canonical_outlet_profile_id": "OUTLET-A51B5D59B93F",
      "canonical_actor_id": null,
      "canonical_source_ids": [
        "SRC-CC1AA98E096D"
      ],
      "behavior_classes": [
        "UNKNOWN"
      ],
      "authenticity_class": "UNKNOWN",
      "revenue_model": [
        "UNKNOWN_REVENUE_MODEL"
      ],
      "classification_basis_event_ids": [],
      "revenue_basis_event_ids": []
    },
    {
      "source_id": "WOL-SRC-KHATAM-AL-ANBIYA",
      "display_name": "Khatam al-Anbiya Central Headquarters",
      "source_entity_type": "INSTITUTION",
      "country_region": "Iran",
      "primary_platform": null,
      "canonical_outlet_profile_id": null,
      "canonical_actor_id": null,
      "canonical_source_ids": [
        "SRC-9AD88556FB4C",
        "SRC-CB6893671B1F"
      ],
      "behavior_classes": [
        "STATE_OFFICIAL_MISINFORMATION_SOURCE"
      ],
      "authenticity_class": "UNKNOWN",
      "revenue_model": [
        "UNKNOWN_REVENUE_MODEL"
      ],
      "classification_basis_event_ids": [
        "WOL-EVT-F15E-001",
        "WOL-EVT-F15E-007"
      ],
      "revenue_basis_event_ids": []
    },
    {
      "source_id": "WOL-SRC-MOHAMMAD-MOLAEI",
      "display_name": "Mohammad Molaei",
      "source_entity_type": "PERSON",
      "country_region": null,
      "primary_platform": null,
      "canonical_outlet_profile_id": null,
      "canonical_actor_id": null,
      "canonical_source_ids": [
        "SRC-03F069A69AAF"
      ],
      "behavior_classes": [
        "UNKNOWN"
      ],
      "authenticity_class": "UNKNOWN",
      "revenue_model": [
        "UNKNOWN_REVENUE_MODEL"
      ],
      "classification_basis_event_ids": [],
      "revenue_basis_event_ids": []
    },
    {
      "source_id": "WOL-SRC-PRESS-TV",
      "display_name": "Press TV",
      "source_entity_type": "OUTLET",
      "country_region": "Iran",
      "primary_platform": "Web",
      "canonical_outlet_profile_id": "OUTLET-7B62913B395D",
      "canonical_actor_id": null,
      "canonical_source_ids": [
        "SRC-03F069A69AAF",
        "SRC-2867CB793392",
        "SRC-481DC6A8E2DB",
        "SRC-7E2DE3FC127A",
        "SRC-9AD88556FB4C",
        "SRC-CB6893671B1F"
      ],
      "behavior_classes": [
        "NARRATIVE_MUTATION_OFFENDER",
        "STATE_OFFICIAL_MISINFORMATION_SOURCE"
      ],
      "authenticity_class": "UNKNOWN",
      "revenue_model": [
        "UNKNOWN_REVENUE_MODEL"
      ],
      "classification_basis_event_ids": [
        "WOL-EVT-F15E-002",
        "WOL-EVT-F15E-008",
        "WOL-EVT-F15E-013"
      ],
      "revenue_basis_event_ids": []
    },
    {
      "source_id": "WOL-SRC-PROVINCIAL-IRGC",
      "display_name": "Provincial IRGC",
      "source_entity_type": "INSTITUTION",
      "country_region": "Iran",
      "primary_platform": null,
      "canonical_outlet_profile_id": null,
      "canonical_actor_id": "ACT-IRGC",
      "canonical_source_ids": [
        "SRC-CC1AA98E096D"
      ],
      "behavior_classes": [
        "OFFICIAL_SOURCE"
      ],
      "authenticity_class": "UNKNOWN",
      "revenue_model": [
        "UNKNOWN_REVENUE_MODEL"
      ],
      "classification_basis_event_ids": [
        "WOL-EVT-F15E-006"
      ],
      "revenue_basis_event_ids": []
    },
    {
      "source_id": "WOL-SRC-QALIBAF",
      "display_name": "Mohammad Baqer Qalibaf",
      "source_entity_type": "PERSON",
      "country_region": "Iran",
      "primary_platform": null,
      "canonical_outlet_profile_id": null,
      "canonical_actor_id": "ACT-PER-MOHAMMAD-BAQER-QALIBAF",
      "canonical_source_ids": [
        "SRC-2867CB793392"
      ],
      "behavior_classes": [
        "STATE_OFFICIAL_MISINFORMATION_SOURCE"
      ],
      "authenticity_class": "UNKNOWN",
      "revenue_model": [
        "UNKNOWN_REVENUE_MODEL"
      ],
      "classification_basis_event_ids": [
        "WOL-EVT-F15E-003"
      ],
      "revenue_basis_event_ids": []
    },
    {
      "source_id": "WOL-SRC-REUTERS",
      "display_name": "Reuters",
      "source_entity_type": "OUTLET",
      "country_region": "United Kingdom",
      "primary_platform": "Web",
      "canonical_outlet_profile_id": "OUTLET-234330834C41",
      "canonical_actor_id": "ACT-REUTERS",
      "canonical_source_ids": [
        "SRC-7471ECB26165"
      ],
      "behavior_classes": [
        "JOURNALISTIC_SOURCE"
      ],
      "authenticity_class": "UNKNOWN",
      "revenue_model": [
        "UNKNOWN_REVENUE_MODEL"
      ],
      "classification_basis_event_ids": [
        "WOL-EVT-F15E-010"
      ],
      "revenue_basis_event_ids": []
    },
    {
      "source_id": "WOL-SRC-TASNIM",
      "display_name": "Tasnim News Agency",
      "source_entity_type": "OUTLET",
      "country_region": null,
      "primary_platform": "Web",
      "canonical_outlet_profile_id": "OUTLET-AA437F617622",
      "canonical_actor_id": null,
      "canonical_source_ids": [
        "SRC-9AD0DC8629DD",
        "SRC-F8AA5DA10F47"
      ],
      "behavior_classes": [
        "STATE_OFFICIAL_MISINFORMATION_SOURCE"
      ],
      "authenticity_class": "UNKNOWN",
      "revenue_model": [
        "UNKNOWN_REVENUE_MODEL"
      ],
      "classification_basis_event_ids": [
        "WOL-EVT-F15E-005"
      ],
      "revenue_basis_event_ids": []
    },
    {
      "source_id": "WOL-SRC-UNATTRIBUTED-MEDIA-MED-001",
      "display_name": "Unattributed media circulation — MED-001",
      "source_entity_type": "OTHER",
      "country_region": null,
      "primary_platform": null,
      "canonical_outlet_profile_id": null,
      "canonical_actor_id": null,
      "canonical_source_ids": [
        "SRC-5BC8070E8CD9"
      ],
      "behavior_classes": [
        "UNKNOWN"
      ],
      "authenticity_class": "UNKNOWN",
      "revenue_model": [
        "UNKNOWN_REVENUE_MODEL"
      ],
      "classification_basis_event_ids": [],
      "revenue_basis_event_ids": []
    },
    {
      "source_id": "WOL-SRC-UNATTRIBUTED-MEDIA-MED-002",
      "display_name": "Unattributed media circulation — MED-002",
      "source_entity_type": "OTHER",
      "country_region": null,
      "primary_platform": null,
      "canonical_outlet_profile_id": null,
      "canonical_actor_id": null,
      "canonical_source_ids": [
        "SRC-00FF7E1E6EA4"
      ],
      "behavior_classes": [
        "UNKNOWN"
      ],
      "authenticity_class": "UNKNOWN",
      "revenue_model": [
        "UNKNOWN_REVENUE_MODEL"
      ],
      "classification_basis_event_ids": [],
      "revenue_basis_event_ids": []
    },
    {
      "source_id": "WOL-SRC-UNATTRIBUTED-MEDIA-MED-003",
      "display_name": "Unattributed media circulation — MED-003",
      "source_entity_type": "OTHER",
      "country_region": null,
      "primary_platform": null,
      "canonical_outlet_profile_id": null,
      "canonical_actor_id": null,
      "canonical_source_ids": [
        "SRC-95219D950347"
      ],
      "behavior_classes": [
        "UNKNOWN"
      ],
      "authenticity_class": "UNKNOWN",
      "revenue_model": [
        "UNKNOWN_REVENUE_MODEL"
      ],
      "classification_basis_event_ids": [],
      "revenue_basis_event_ids": []
    },
    {
      "source_id": "WOL-SRC-UNATTRIBUTED-MEDIA-MED-004",
      "display_name": "Unattributed media circulation — MED-004",
      "source_entity_type": "OTHER",
      "country_region": null,
      "primary_platform": null,
      "canonical_outlet_profile_id": null,
      "canonical_actor_id": null,
      "canonical_source_ids": [
        "SRC-FADB5E0A4585"
      ],
      "behavior_classes": [
        "UNKNOWN"
      ],
      "authenticity_class": "UNKNOWN",
      "revenue_model": [
        "UNKNOWN_REVENUE_MODEL"
      ],
      "classification_basis_event_ids": [],
      "revenue_basis_event_ids": []
    },
    {
      "source_id": "WOL-SRC-USCENTCOM",
      "display_name": "U.S. Central Command",
      "source_entity_type": "INSTITUTION",
      "country_region": "United States",
      "primary_platform": null,
      "canonical_outlet_profile_id": "OUTLET-939785E7D945",
      "canonical_actor_id": null,
      "canonical_source_ids": [
        "SRC-694207959BE5"
      ],
      "behavior_classes": [
        "OFFICIAL_SOURCE"
      ],
      "authenticity_class": "UNKNOWN",
      "revenue_model": [